2008~2018,21-1015,Rehabilitation Counselors,"Counsel individuals to maximize the independence and employability of persons coping with personal, social, and vocational difficulties that result from birth defects, illness, disease, accidents, or the stress of daily life.  Coordinate activities for residents of care and treatment facilities.  Assess client needs and design and implement rehabilitation programs that may include personal and vocational counseling, training, and job placement.",,,,,,,,,,0.321602778,343,Bottom 45%,-0.012683239,473,Bottom 25%
2008~2018,21-1021,"Child, Family, and School Social Workers","Provide social services and assistance to improve the social and psychological functioning of children and their families and to maximize the family well-being and the academic functioning of children.  May assist parents, arrange adoptions, and find foster homes for abandoned or abused children.  In schools, they address such problems as teenage pregnancy, misbehavior, and truancy.  May also advise teachers.",,,,,,,,,,1.200977164,96,Top 20%,0.008570274,135,Top 25%
2008~2018,21-1022,Healthcare Social Workers,"Provide individuals, families, and groups with the psychosocial support needed to cope with chronic, acute, or terminal illnesses.  Services include advising family care givers, providing patient education and counseling, and making referrals for other services.  May also provide care and case management or interventions designed to promote health, prevent disease, and address barriers to access to healthcare.",,,,,,,,,,-0.204912591,480,Bottom 25%,0.026356495,77,Top 15%
2008~2018,21-1023,Mental Health and Substance Abuse Social Workers,"Assess and treat individuals with mental, emotional, or substance abuse problems, including abuse of alcohol, tobacco, and/or other drugs.  Activities may include individual and group therapy, crisis intervention, case management, client advocacy, prevention, and education.",,,,,,,,,,0.76433591,216,Top 35%,-0.015113221,492,Bottom 25%
2008~2018,21-1091,Health Educators,"Provide and manage health education programs that help individuals, families, and their communities maximize and maintain healthy lifestyles.  Collect and analyze data to identify community needs prior to planning, implementing, monitoring, and evaluating programs designed to encourage healthy lifestyles, policies, and environments.  May serve as resource to assist individuals, other health professionals, or the community, and may administer fiscal resources for health education programs.  Excludes “Community Health Workers” (21-1094).",,,,,,,,,,-0.206579477,481,Bottom 25%,-0.006617869,412,Bottom 35%
2008~2018,21-1092,Probation Officers and Correctional Treatment Specialists,"Provide social services to assist in rehabilitation of law offenders in custody or on probation or parole.  Make recommendations for actions involving formulation of rehabilitation plan and treatment of offender, including conditional release and education and employment stipulations.",,,,,,,,,,1.893979383,25,Top 5%,-0.017365063,509,Bottom 20%
2008~2018,21-1093,Social and Human Service Assistants,"Assist in providing client services in a wide variety of fields, such as psychology, rehabilitation, or social work, including support for families.  May assist clients in identifying and obtaining available benefits and social and community services.  May assist social workers with developing, organizing, and conducting programs to prevent and resolve problems relevant to substance abuse, human relationships, rehabilitation, or dependent care.  Excludes ""Rehabilitation Counselors"" (21-1015), ""Psychiatric Technicians"" (29-2053), ""Personal Care Aides"" (39-9021), and ""Eligibility Interviewers, Government Programs"" (43-4061).",,,,,,,,,,0.877173202,189,Top 35%,0.022248452,88,Top 15%
2008~2018,21-2011,Clergy,Conduct religious worship and perform other spiritual functions associated with beliefs and practices of religious faith or denomination.  Provide spiritual and moral guidance and assistance to members.,,,,,,,,,,0.172566717,390,Bottom 40%,0.003598133,177,Top 30%
2008~2018,21-2021,"Directors, Religious Activities and Education","Plan, direct, or coordinate programs designed to promote the religious education or activities of a denominational group.  May provide counseling and guidance relative to marital, health, financial, and religious problems.",,,,,,,,,,1.319448946,82,Top 15%,0.003835775,174,Top 30%
2008~2018,23-1011,Lawyers,"Represent clients in criminal and civil litigation and other legal proceedings, draw up legal documents, or manage or advise clients on legal transactions.  May specialize in a single area or may practice broadly in many areas of law. ",,,,,,,,,,1.138468986,110,Top 20%,0.043972086,44,Top 10%
2008~2018,23-1012,Judicial Law Clerks,"Assist judges in court or by conducting research or preparing legal documents.  Excludes ""Lawyers"" (23-1011) and ""Paralegals and Legal Assistants"" (23-2011).",,,,,,,,,,0.915765844,177,Top 30%,-0.010830184,461,Bottom 30%
2008~2018,23-1021,"Administrative Law Judges, Adjudicators, and Hearing Officers","Conduct hearings to recommend or make decisions on claims concerning government programs or other government-related matters.  Determine liability, sanctions, or penalties, or recommend the acceptance or rejection of claims or settlements.  Excludes “Arbitrators, Mediators, and Conciliators” (23-1022).",,,,,,,,,,0.518224585,287,Top 50%,0.000596354,243,Top 40%
2008~2018,23-1022,"Arbitrators, Mediators, and Conciliators",Facilitate negotiation and conflict resolution through dialogue.  Resolve conflicts outside of the court system by mutual consent of parties involved.,,,,,,,,,,0.970771587,156,Top 30%,-0.004533952,382,Bottom 40%
2008~2018,23-1023,"Judges, Magistrate Judges, and Magistrates","Arbitrate, advise, adjudicate, or administer justice in a court of law.  May sentence defendant in criminal cases according to government statutes or sentencing guidelines.  May determine liability of defendant in civil cases.  May perform wedding ceremonies.",,,,,,,,,,0.956488686,162,Top 30%,0.001956222,211,Top 35%
2008~2018,23-2011,Paralegals and Legal Assistants,"Assist lawyers by investigating facts, preparing legal documents, or researching legal precedent.  Conduct research to support a legal proceeding, to formulate a defense, or to initiate legal action.  Excludes “Legal Secretaries” (43-6012).",,,,,,,,,,0.987351624,153,Top 25%,0.012914675,115,Top 20%
2008~2018,23-2091,Court Reporters,"Use verbatim methods and equipment to capture, store, retrieve, and transcribe pretrial and trial proceedings or other information.  Includes stenocaptioners who operate computerized stenographic captioning equipment to provide captions of live or prerecorded broadcasts for hearing-impaired viewers.",,,,,,,,,,0.775667891,213,Top 35%,-0.004841143,386,Bottom 40%
2008~2018,23-2093,"Title Examiners, Abstractors, and Searchers","Search real estate records, examine titles, or summarize pertinent legal or insurance documents or details for a variety of purposes.  May compile lists of mortgages, contracts, and other instruments pertaining to titles by searching public and private records for law firms, real estate agencies, or title insurance companies.",,,,,,,,,,1.71577572,38,Top 10%,-0.008982622,443,Bottom 30%
2008~2018,25-1011,"Business Teachers, Postsecondary","Teach courses in business administration and management, such as accounting, finance, human resources, labor and industrial relations, marketing, and operations research.  Includes both teachers primarily engaged in teaching and those who do a combination of teaching and research.",,,,,,,,,,0.228064847,375,Bottom 40%,0.02649141,75,Top 15%
2008~2018,25-1021,"Computer Science Teachers, Postsecondary","Teach courses in computer science.  May specialize in a field of computer science, such as the design and function of computers or operations and research analysis.  Includes both teachers primarily engaged in teaching and those who do a combination of teaching and research.",,,,,,,,,,-0.602486207,541,Bottom 15%,-0.000227358,270,Top 45%
2008~2018,25-1022,"Mathematical Science Teachers, Postsecondary","Teach courses pertaining to mathematical concepts, statistics, and actuarial science and to the application of original and standardized mathematical techniques in solving specific problems and situations.  Includes both teachers primarily engaged in teaching and those who do a combination of teaching and research.",,,,,,,,,,0.130329923,405,Bottom 35%,0.006474255,150,Top 25%
2008~2018,25-1031,"Architecture Teachers, Postsecondary","Teach courses in architecture and architectural design, such as architectural environmental design, interior architecture/design, and landscape architecture.  Includes both teachers primarily engaged in teaching and those who do a combination of teaching and research.",,,,,,,,,,-0.088198169,458,Bottom 30%,0.000814107,239,Top 40%
2008~2018,25-1032,"Engineering Teachers, Postsecondary","Teach courses pertaining to the application of physical laws and principles of engineering for the development of machines, materials, instruments, processes, and services.  Includes teachers of subjects such as chemical, civil, electrical, industrial, mechanical, mineral, and petroleum engineering.  Includes both teachers primarily engaged in teaching and those who do a combination of teaching and research.  Excludes ""Computer Science Teachers, Postsecondary"" (25-1021).",,,,,,,,,,0.210360315,380,Bottom 40%,0.007952511,140,Top 25%
2008~2018,25-1041,"Agricultural Sciences Teachers, Postsecondary","Teach courses in the agricultural sciences.  Includes teachers of agronomy, dairy sciences, fisheries management, horticultural sciences, poultry sciences, range management, and agricultural soil conservation.  Includes both teachers primarily engaged in teaching and those who do a combination of teaching and research.  Excludes “Forestry and Conservation Science Teachers, Postsecondary” (25-1043).",,,,,,,,,,0.623530045,252,Top 45%,-0.000465846,280,Top 50%
2008~2018,25-1042,"Biological Science Teachers, Postsecondary",Teach courses in biological sciences.  Includes both teachers primarily engaged in teaching and those who do a combination of teaching and research.,,,,,,,,,,0.240814303,369,Bottom 45%,-0.009239406,446,Bottom 30%
2008~2018,25-1043,"Forestry and Conservation Science Teachers, Postsecondary","Teach courses in forestry and conservation science.  Includes both teachers primarily engaged in teaching and those who do a combination of teaching and research.  Excludes ""Agricultural Science Teachers, Postsecondary"" (25-1041) and “Environmental Science Teachers, Postsecondary” (25-1053).",,,,,,,,,,0.497509786,292,Top 50%,-0.000366298,277,Top 45%
2008~2018,25-1051,"Atmospheric, Earth, Marine, and Space Sciences Teachers, Postsecondary","Teach courses in the physical sciences, except chemistry and physics.  Includes both teachers primarily engaged in teaching, and those who do a combination of teaching and research.",,,,,,,,,,-0.581137828,537,Bottom 15%,0.001562327,220,Top 40%
2008~2018,25-1052,"Chemistry Teachers, Postsecondary","Teach courses pertaining to the chemical and physical properties and compositional changes of substances.  Work may include instruction in the methods of qualitative and quantitative chemical analysis.  Includes both teachers primarily engaged in teaching, and those who do a combination of teaching and research.  Excludes ""Biological Science Teachers, Postsecondary"" (25-1042) who teach biochemistry.",,,,,,,,,,-0.0753813,455,Bottom 30%,-0.00012109,266,Top 45%
2008~2018,25-1053,"Environmental Science Teachers, Postsecondary",Teach courses in environmental science.  Includes both teachers primarily engaged in teaching and those who do a combination of teaching and research.,,,,,,,,,,-0.114052526,463,Bottom 30%,0.001235083,231,Top 40%
2008~2018,25-1054,"Physics Teachers, Postsecondary",Teach courses pertaining to the laws of matter and energy.  Includes both teachers primarily engaged in teaching and those who do a combination of teaching and research.,,,,,,,,,,0.057699423,426,Bottom 35%,0.001717165,218,Top 40%
2008~2018,25-1061,"Anthropology and Archeology Teachers, Postsecondary",Teach courses in anthropology or archeology.  Includes both teachers primarily engaged in teaching and those who do a combination of teaching and research.,,,,,,,,,,-0.213849527,485,Bottom 25%,0.000449155,248,Top 40%
2008~2018,25-1062,"Area, Ethnic, and Cultural Studies Teachers, Postsecondary","Teach courses pertaining to the culture and development of an area, an ethnic group, or any other group, such as Latin American studies, women’s studies, or urban affairs.  Includes both teachers primarily engaged in teaching and those who do a combination of teaching and research.",,,,,,,,,,-0.034613258,445,Bottom 30%,0.002298268,202,Top 35%
2008~2018,25-1063,"Economics Teachers, Postsecondary",Teach courses in economics.  Includes both teachers primarily engaged in teaching and those who do a combination of teaching and research.,,,,,,,,,,-0.509183198,528,Bottom 15%,0.000821842,238,Top 40%
2008~2018,25-1064,"Geography Teachers, Postsecondary",Teach courses in geography.  Includes both teachers primarily engaged in teaching and those who do a combination of teaching and research.,,,,,,,,,,0.68358207,238,Top 40%,-2.67622E-05,263,Top 45%
2008~2018,25-1065,"Political Science Teachers, Postsecondary","Teach courses in political science, international affairs, and international relations.  Includes both teachers primarily engaged in teaching and those who do a combination of teaching and research.",,,,,,,,,,-0.186156365,478,Bottom 25%,0.002557663,196,Top 35%
2008~2018,25-1066,"Psychology Teachers, Postsecondary","Teach courses in psychology, such as child, clinical, and developmental psychology, and psychological counseling.  Includes both teachers primarily engaged in teaching and those who do a combination of teaching and research.",,,,,,,,,,-0.097375486,459,Bottom 30%,0.007613826,143,Top 25%
2008~2018,25-1067,"Sociology Teachers, Postsecondary",Teach courses in sociology.  Includes both teachers primarily engaged in teaching and those who do a combination of teaching and research.,,,,,,,,,,-0.318624673,508,Bottom 20%,-0.005001609,388,Bottom 40%
2008~2018,25-1071,"Health Specialties Teachers, Postsecondary","Teach courses in health specialties, in fields such as dentistry, laboratory technology, medicine, pharmacy, public health, therapy, and veterinary medicine.  Excludes ""Nursing Instructors and Teachers, Postsecondary"" (25-1072) and ""Biological Science Teachers, Postsecondary"" (25-1042) who teach medical science.",,,,,,,,,,0.126719438,407,Bottom 35%,0.122265776,16,Top 5%
2008~2018,25-1072,"Nursing Instructors and Teachers, Postsecondary",Demonstrate and teach patient care in classroom and clinical units to nursing students.  Includes both teachers primarily engaged in teaching and those who do a combination of teaching and research.,,,,,,,,,,0.23393196,372,Bottom 45%,0.011107276,123,Top 20%
2008~2018,25-1081,"Education Teachers, Postsecondary","Teach courses pertaining to education, such as counseling, curriculum, guidance, instruction, teacher education, and teaching English as a second language.  Includes both teachers primarily engaged in teaching and those who do a combination of teaching and research.",,,,,,,,,,0.186569787,385,Bottom 40%,0.001877923,213,Top 35%
2008~2018,25-1082,"Library Science Teachers, Postsecondary",Teach courses in library science.  Includes both teachers primarily engaged in teaching and those who do a combination of teaching and research.,,,,,,,,,,0.268414463,359,Bottom 45%,0.000520831,245,Top 40%
2008~2018,25-1111,"Criminal Justice and Law Enforcement Teachers, Postsecondary","Teach courses in criminal justice, corrections, and law enforcement administration.  Includes both teachers primarily engaged in teaching and those who do a combination of teaching and research.",,,,,,,,,,0.300371808,351,Bottom 45%,0.002702547,192,Top 35%
2008~2018,25-1112,"Law Teachers, Postsecondary",Teach courses in law.  Includes both teachers primarily engaged in teaching and those who do a combination of teaching and research.,,,,,,,,,,-0.326485938,509,Bottom 20%,0.009039423,132,Top 25%
2008~2018,25-1113,"Social Work Teachers, Postsecondary",Teach courses in social work.  Includes both teachers primarily engaged in teaching and those who do a combination of teaching and research.,,,,,,,,,,-0.40943665,519,Bottom 20%,0.004875365,165,Top 30%
2008~2018,25-1121,"Art, Drama, and Music Teachers, Postsecondary","Teach courses in drama, music, and the arts including fine and applied art, such as painting and sculpture, or design and crafts.  Includes both teachers primarily engaged in teaching and those who do a combination of teaching and research.",,,,,,,,,,-0.272937811,500,Bottom 20%,0.020163326,93,Top 15%
2008~2018,25-1122,"Communications Teachers, Postsecondary","Teach courses in communications, such as organizational communications, public relations, radio/television broadcasting, and journalism.  Includes both teachers primarily engaged in teaching and those who do a combination of teaching and research.",,,,,,,,,,-0.222436883,488,Bottom 25%,0.004150128,173,Top 30%
2008~2018,25-1123,"English Language and Literature Teachers, Postsecondary","Teach courses in English language and literature, including linguistics and comparative literature.  Includes both teachers primarily engaged in teaching and those who do a combination of teaching and research.",,,,,,,,,,-0.266202653,499,Bottom 20%,0.002984866,186,Top 30%
2008~2018,25-1124,"Foreign Language and Literature Teachers, Postsecondary",Teach languages and literature courses in languages other than English.  Includes teachers of American Sign Language (ASL).  Includes both teachers primarily engaged in teaching and those who do a combination of teaching and research.  ,,,,,,,,,,-0.086824291,457,Bottom 30%,-0.00341055,362,Bottom 45%
2008~2018,25-1125,"History Teachers, Postsecondary",Teach courses in human history and historiography.  Includes both teachers primarily engaged in teaching and those who do a combination of teaching and research.,,,,,,,,,,-0.298384441,504,Bottom 20%,-0.002315725,327,Bottom 50%
2008~2018,25-1126,"Philosophy and Religion Teachers, Postsecondary","Teach courses in philosophy, religion, and theology.  Includes both teachers primarily engaged in teaching and those who do a combination of teaching and research.",,,,,,,,,,-0.261122032,496,Bottom 25%,0.005435849,159,Top 30%
2008~2018,25-1191,Graduate Teaching Assistants,"Assist faculty or other instructional staff in postsecondary institutions by performing teaching or teaching-related duties, such as teaching lower level courses, developing teaching materials, preparing and giving examinations, and grading examinations or papers.  Graduate teaching assistants must be enrolled in a graduate school program.  Graduate assistants who primarily perform non-teaching duties, such as research, should be reported in the occupational category related to the work performed.  Excludes “Teacher Assistants” (25-9041).",,,,,,,,,,0.742878162,220,Top 40%,-0.00546786,394,Bottom 40%
2008~2018,25-1192,"Home Economics Teachers, Postsecondary","Teach courses in childcare, family relations, finance, nutrition, and related subjects pertaining to home management.  Includes both teachers primarily engaged in teaching and those who do a combination of teaching and research.",,,,,,,,,,0.777189392,212,Top 35%,-0.004413097,380,Bottom 40%
2008~2018,25-1193,"Recreation and Fitness Studies Teachers, Postsecondary","Teach courses pertaining to recreation, leisure, and fitness studies, including exercise physiology and facilities management.  Includes both teachers primarily engaged in teaching and those who do a combination of teaching and research.",,,,,,,,,,1.062584785,130,Top 25%,-0.002903367,345,Bottom 45%
2008~2018,25-1194,"Vocational Education Teachers, Postsecondary","Teach or instruct vocational or occupational subjects at the postsecondary level (but at less than the baccalaureate) to students who have graduated or left high school.  Includes correspondence school instructors; industrial, commercial, and government training instructors; and adult education teachers and instructors who prepare persons to operate industrial machinery and equipment and transportation and communications equipment.  Teaching may take place in public or private schools whose primary business is education or in a school associated with an organization whose primary business is other than education.",,,,,,,,,,-0.389762447,516,Bottom 20%,-0.015958614,498,Bottom 20%
2008~2018,25-2011,"Preschool Teachers, Except Special Education","Instruct preschool-aged children in activities designed to promote social, physical, and intellectual growth needed for primary school in preschool, day care center, or other child development facility.  Substitute teachers are included in ""Teachers and Instructors, All Other"" (25-3099).  May be required to hold State certification.  Excludes ""Childcare Workers"" (39-9011) and ""Special Education Teachers"" (25-2050).",,,,,,,,,,0.897135308,182,Top 30%,0.01608701,105,Top 20%
2008~2018,25-2012,"Kindergarten Teachers, Except Special Education","Teach elemental natural and social science, personal hygiene, music, art, and literature to kindergarten students.  Promote physical, mental, and social development.  May be required to hold State certification.  Substitute teachers are included in ""Teachers and Instructors, All Other"" (25-3099).  Excludes ""Special Education Teachers"" (25-2050).",,,,,,,,,,-0.641738143,547,Bottom 15%,-0.05726765,590,Bottom 5%
2008~2018,25-2021,"Elementary School Teachers, Except Special Education","Teach students basic academic, social, and other formative skills in public or private schools at the elementary level.  Substitute teachers are included in ""Teachers and Instructors, All Other"" (25-3099).  Excludes ""Special Education Teachers"" (25-2050).",,,,,,,,,,0.14632329,401,Bottom 40%,-0.270449519,616,Bottom 5%
2008~2018,25-2022,"Middle School Teachers, Except Special and Career/Technical Education","Teach students in one or more subjects in public or private schools at the middle, intermediate, or junior high level, which falls between elementary and senior high school as defined by applicable laws and regulations.  Substitute teachers are included in ""Teachers and Instructors, All Other"" (25-3099).  Excludes ""Career/Technical Education Teachers, Middle School "" (25-2023) and ""Special Education Teachers"" (25-2050).  ",,,,,,,,,,0.781192428,211,Top 35%,-0.116841576,607,Bottom 5%
2008~2018,25-2023,"Career/Technical Education Teachers, Middle School","Teach occupational, career and technical, or vocational subjects in public or private schools at the middle, intermediate, or junior high level, which falls between elementary and senior high school as defined by applicable laws and regulations.  Substitute teachers are included in ""Teachers and Instructors, All Other"" (25-3099).  Excludes ""Special Education Teachers"" (25-2050). ",,,,,,,,,,1.10290607,114,Top 20%,-0.004377554,379,Bottom 40%
2008~2018,25-2031,"Secondary School Teachers, Except Special and Career/Technical Education","Teach students in one or more subjects, such as English, mathematics, or social studies at the secondary level in public or private schools.  May be designated according to subject matter specialty.  Substitute teachers are included in ""Teachers and Instructors, All Other"" (25-3099).  Excludes ""Career/Technical Education Teachers, Secondary School"" (25-2032) and ""Special Education Teachers"" (25-2050).",,,,,,,,,,0.582245524,268,Top 45%,-0.149667688,611,Bottom 5%
2008~2018,25-2032,"Career/Technical Education Teachers, Secondary School","Teach occupational, career and technical, or vocational subjects at the secondary school level in public or private schools.  Substitute teachers are included in ""Teachers and Instructors, All Other"" (25-3099).  Excludes “Special Education Teachers, Secondary School” (25-2054).",,,,,,,,,,0.456311098,308,Top 50%,-0.033107393,556,Bottom 15%
2008~2018,25-2053,"Special Education Teachers, Middle School","Teach middle school subjects to educationally and physically handicapped students.  Includes teachers who specialize and work with audibly and visually handicapped students and those who teach basic academic and life processes skills to the mentally impaired.  Substitute teachers are included in ""Teachers and Instructors, All Other"" (25-3099).  ",,,,,,,,,,0.447325236,312,Bottom 50%,-0.021273154,522,Bottom 20%
2008~2018,25-2054,"Special Education Teachers, Secondary School","Teach secondary school subjects to educationally and physically handicapped students.  Includes teachers who specialize and work with audibly and visually handicapped students and those who teach basic academic and life processes skills to the mentally impaired.  Substitute teachers are included in ""Teachers and Instructors, All Other"" (25-3099).  ",,,,,,,,,,0.925045329,174,Top 30%,-0.019591607,513,Bottom 20%
2008~2018,25-3011,Adult Basic and Secondary Education and Literacy Teachers and Instructors,"Teach or instruct out-of-school youths and adults in remedial education classes, preparatory classes for the General Educational Development test, literacy, or English as a Second Language.  Teaching may or may not take place in a traditional educational institution.",,,,,,,,,,0.236821713,370,Bottom 45%,-0.021682062,524,Bottom 20%
