2018,29-2051,Dietetic Technicians,"Assist in the provision of food service and nutritional programs, under the supervision of a dietitian.  May plan and produce meals based on established guidelines, teach principles of food and nutrition, or counsel individuals.",48.7 ,321,Bottom 50%,33540,392,Bottom 40%,30130,561,Bottom 10%,,,,,,
2018,29-2052,Pharmacy Technicians,"Prepare medications under the direction of a pharmacist.  May measure, mix, count out, label, and record amounts and dosages of medications according to prescription orders.",51.2 ,84,Top 15%,417860,68,Top 15%,34020,521,Bottom 20%,,,,,,
2018,29-2053,Psychiatric Technicians,"Care for individuals with mental or emotional conditions or disabilities, following the instructions of physicians or other health practitioners.  Monitor patients' physical and emotional well-being and report to medical staff.  May participate in rehabilitation and treatment programs, help with personal hygiene, and administer oral or injectable medications.",48.5 ,357,Bottom 45%,71360,280,Top 50%,37760,471,Bottom 25%,,,,,,
2018,29-2054,Respiratory Therapy Technicians,Provide respiratory care under the direction of respiratory therapists and physicians.,49.2 ,253,Top 45%,9090,553,Bottom 15%,51380,320,Bottom 50%,,,,,,
2018,29-2055,Surgical Technologists,"Assist in operations, under the supervision of surgeons, registered nurses, or other surgical personnel.  May help set up operating room, prepare and transport patients for surgery, adjust lights and equipment, pass instruments and other supplies to surgeons and surgeon's assistants, hold retractors, cut sutures, and help count sponges, needles, supplies, and instruments.",49.6 ,205,Top 35%,110160,217,Top 35%,49040,344,Bottom 45%,,,,,,
2018,29-2056,Veterinary Technologists and Technicians,"Perform medical tests in a laboratory environment for use in the treatment and diagnosis of diseases in animals.  Prepare vaccines and serums for prevention of diseases.  Prepare tissue samples, take blood samples, and execute laboratory tests, such as urinalysis and blood counts.  Clean and sterilize instruments and materials and maintain equipment and machines.  May assist a veterinarian during surgery. ",49.4 ,230,Top 40%,106680,223,Top 40%,35560,504,Bottom 20%,,,,,,
2018,29-2061,Licensed Practical and Licensed Vocational Nurses,"Care for ill, injured, or convalescing patients or persons with disabilities in hospitals, nursing homes, clinics, private homes, group homes, and similar institutions.  May work under the supervision of a registered nurse.  Licensing required.",48.5 ,354,Bottom 45%,701690,35,Top 10%,47050,358,Bottom 45%,,,,,,
2018,29-2071,Medical Records and Health Information Technicians,"Compile, process, and maintain medical records of hospital and clinic patients in a manner consistent with medical, administrative, ethical, legal, and regulatory requirements of the health care system.  Process, maintain, compile, and report patient information for health requirements and standards in a manner consistent with the healthcare industry’s numerical coding system.  Excludes “File Clerks” (43-4071).",57.8 ,3,Top 1%,208650,138,Top 25%,44010,393,Bottom 40%,,,,,,
2018,29-2081,"Opticians, Dispensing","Design, measure, fit, and adapt lenses and frames for client according to written optical prescription or specification.  Assist client with inserting, removing, and caring for contact lenses.  Assist client with selecting frames.  Measure customer for size of eyeglasses and coordinate frames with facial and eye measurements and optical prescription.  Prepare work order for optical laboratory containing instructions for grinding and mounting lenses in frames.  Verify exactness of finished lens spectacles.  Adjust frame and lens position to fit client.  May shape or reshape frames.  Includes contact lens opticians.",49.0 ,279,Top 45%,72250,277,Top 45%,39930,451,Bottom 30%,,,,,,
2018,29-2091,Orthotists and Prosthetists,"Design, measure, fit, and adapt orthopedic braces, appliances or prostheses, such as limbs or facial parts for patients with disabling conditions.",47.9 ,431,Bottom 35%,8830,555,Bottom 15%,73860,168,Top 30%,,,,,,
2018,29-9011,Occupational Health and Safety Specialists,"Review, evaluate, and analyze work environments and design programs and procedures to control, eliminate, and prevent disease or injury caused by chemical, physical, and biological agents or ergonomic factors.  May conduct inspections and enforce adherence to laws and regulations governing the health and safety of individuals.  May be employed in the public or private sector.  Includes environmental protection officers.",49.0 ,297,Top 50%,88390,248,Top 40%,74940,165,Top 30%,,,,,,
2018,29-9012,Occupational Health and Safety Technicians,"Collect data on work environments for analysis by occupational health and safety specialists.  Implement and conduct evaluation of programs designed to limit chemical, physical, biological, and ergonomic risks to workers.",49.1 ,271,Top 45%,18020,477,Bottom 25%,55270,288,Top 50%,,,,,,
2018,29-9091,Athletic Trainers,"Evaluate and advise individuals to assist recovery from or avoid athletic-related injuries or illnesses, or maintain peak physical fitness.  May provide first aid or emergency care.",46.7 ,558,Bottom 15%,26890,428,Bottom 35%,49280,340,Bottom 50%,,,,,,
2018,31-1011,Home Health Aides,"Provide routine individualized healthcare such as changing bandages and dressing wounds, and applying topical medications to the elderly, convalescents, or persons with disabilities at the patient’s home or in a care facility.  Monitor or report changes in health status.  May also provide personal care such as bathing, dressing, and grooming of patient.",46.7 ,560,Bottom 10%,797670,33,Top 10%,25330,600,Bottom 5%,,,,,,
2018,31-1013,Psychiatric Aides,"Assist mentally impaired or emotionally disturbed patients, working under direction of nursing and medical staff.  May assist with daily living activities, lead patients in educational and recreational activities, or accompany patients to and from examinations and treatments.  May restrain violent patients.  Includes psychiatric orderlies.",47.5 ,493,Bottom 25%,56910,310,Top 50%,31090,552,Bottom 15%,,,,,,
2018,31-2011,Occupational Therapy Assistants,"Assist occupational therapists in providing occupational therapy treatments and procedures.  May, in accordance with State laws, assist in development of treatment plans, carry out routine functions, direct activity programs, and document the progress of treatments.  Generally requires formal training.",47.1 ,526,Bottom 20%,42660,354,Bottom 45%,60410,243,Top 40%,,,,,,
2018,31-2012,Occupational Therapy Aides,"Under close supervision of an occupational therapist or occupational therapy assistant, perform only delegated, selected, or routine tasks in specific situations.  These duties include preparing patient and treatment room.",46.7 ,555,Bottom 15%,7700,566,Bottom 10%,32580,535,Bottom 15%,,,,,,
2018,31-2021,Physical Therapist Assistants,"Assist physical therapists in providing physical therapy treatments and procedures.   May, in accordance with State laws, assist in the development of treatment plans, carry out routine functions, document the progress of treatment, and modify specific treatments in accordance with patient status and within the scope of treatment plans established by a physical therapist.  Generally requires formal training.",46.3 ,571,Bottom 10%,94250,241,Top 40%,57750,273,Top 45%,,,,,,
2018,31-2022,Physical Therapist Aides,"Under close supervision of a physical therapist or physical therapy assistant, perform only delegated, selected, or routine tasks in specific situations.  These duties include preparing the patient and the treatment area.",46.2 ,586,Bottom 10%,47260,342,Bottom 45%,28500,576,Bottom 10%,,,,,,
2018,31-9011,Massage Therapists,"Perform therapeutic massages of soft tissues and joints.  May assist in the assessment of range of motion and muscle strength, or propose client therapy plans.",44.8 ,615,Bottom 5%,105160,224,Top 40%,45880,376,Bottom 40%,,,,,,
2018,31-9091,Dental Assistants,"Assist dentist, set up equipment, prepare patient for treatment, and keep records.",49.4 ,236,Top 40%,341060,93,Top 15%,39770,452,Bottom 30%,,,,,,
2018,31-9092,Medical Assistants,"Perform administrative and certain clinical duties under the direction of a physician.  Administrative duties may include scheduling appointments, maintaining medical records, billing, and coding information for insurance purposes.  Clinical duties may include taking and recording vital signs and medical histories, preparing patients for examination, drawing blood, and administering medications as directed by physician.  Excludes ""Physician Assistants"" (29-1071). ",49.9 ,175,Top 30%,673660,37,Top 10%,34540,513,Bottom 20%,,,,,,
2018,31-9093,Medical Equipment Preparers,"Prepare, sterilize, install, or clean laboratory or healthcare equipment.  May perform routine laboratory tasks and operate or inspect equipment.",50.7 ,109,Top 20%,55610,315,Bottom 50%,37990,468,Bottom 25%,,,,,,
2018,31-9094,Medical Transcriptionists,"Transcribe medical reports recorded by physicians and other healthcare practitioners using various electronic devices, covering office visits, emergency room visits, diagnostic imaging studies, operations, chart reviews, and final summaries.  Transcribe dictated reports and translate abbreviations into fully understandable form.  Edit as necessary and return reports in either printed or electronic form for review and signature, or correction.",56.8 ,6,Top 1%,53730,320,Bottom 50%,36350,493,Bottom 25%,,,,,,
2018,31-9095,Pharmacy Aides,"Record drugs delivered to the pharmacy, store incoming merchandise, and inform the supervisor of stock needs.  May operate cash register and accept prescriptions for filling.",49.3 ,243,Top 40%,36970,378,Bottom 40%,29190,566,Bottom 10%,,,,,,
2018,31-9096,Veterinary Assistants and Laboratory Animal Caretakers,"Feed, water, and examine pets and other nonfarm animals for signs of illness, disease, or injury in laboratories and animal hospitals and clinics.  Clean and disinfect cages and work areas, and sterilize laboratory and surgical equipment.  May provide routine post-operative care, administer medication orally or topically, or prepare samples for laboratory examination under the supervision of veterinary or laboratory animal technologists or technicians, veterinarians, or scientists.  Excludes ""Nonfarm Animal Caretakers"" (39-2021).",47.5 ,485,Bottom 25%,89480,244,Top 40%,28690,573,Bottom 10%,,,,,,
2018,33-1011,First-Line Supervisors of Correctional Officers,Directly supervise and coordinate activities of correctional officers and jailers.,48.7 ,335,Bottom 50%,43760,351,Bottom 45%,68350,190,Top 35%,,,,,,
2018,33-1012,First-Line Supervisors of Police and Detectives,Directly supervise and coordinate activities of members of police force.,48.2 ,393,Bottom 40%,116660,207,Top 35%,93100,90,Top 15%,,,,,,
2018,33-1021,First-Line Supervisors of Fire Fighting and Prevention Workers,Directly supervise and coordinate activities of workers engaged in fire fighting and fire prevention and control.,47.8 ,461,Bottom 30%,65920,292,Top 50%,80310,138,Top 25%,,,,,,
2018,33-2011,Firefighters,"Control and extinguish fires or respond to emergency situations where life, property, or the environment is at risk.  Duties may include fire prevention, emergency medical service, hazardous material response, search and rescue, and disaster assistance. ",47.7 ,462,Bottom 30%,321570,95,Top 20%,53240,308,Top 50%,,,,,,
2018,33-2021,Fire Inspectors and Investigators,"Inspect buildings to detect fire hazards and enforce local ordinances and State laws, or investigate and gather facts to determine cause of fires and explosions.",48.4 ,364,Bottom 45%,12530,523,Bottom 20%,64140,216,Top 35%,,,,,,
2018,33-3011,Bailiffs,Maintain order in courts of law.,49.1 ,270,Top 45%,18900,465,Bottom 30%,49870,334,Bottom 50%,,,,,,
2018,33-3012,Correctional Officers and Jailers,"Guard inmates in penal or rehabilitative institutions in accordance with established regulations and procedures.  May guard prisoners in transit between jail, courtroom, prison, or other point.  Includes deputy sheriffs and police who spend the majority of their time guarding prisoners in correctional institutions.",48.8 ,314,Bottom 50%,415000,71,Top 15%,49300,339,Bottom 50%,,,,,,
2018,33-3021,Detectives and Criminal Investigators,"Conduct investigations related to suspected violations of Federal, State, or local laws to prevent or solve crimes.  Excludes ""Private Detectives and Investigators"" (33-9021).",49.0 ,280,Top 50%,103450,230,Top 40%,85020,122,Top 20%,,,,,,
2018,33-3031,Fish and Game Wardens,Patrol assigned area to prevent fish and game law violations.  Investigate reports of damage to crops or property by wildlife.  Compile biological data.,47.8 ,458,Bottom 30%,6040,580,Bottom 10%,59260,251,Top 45%,,,,,,
2018,33-3041,Parking Enforcement Workers,"Patrol assigned area, such as public parking lot or city streets to issue tickets to overtime parking violators and illegally parked vehicles.",49.5 ,215,Top 35%,8070,562,Bottom 10%,42200,412,Bottom 35%,,,,,,
2018,33-3051,Police and Sheriff's Patrol Officers,"Maintain order and protect life and property by enforcing local, tribal, State, or Federal laws and ordinances.  Perform a combination of the following duties: patrol a specific area; direct traffic; issue traffic summonses; investigate accidents; apprehend and arrest suspects, or serve legal processes of courts. ",48.6 ,343,Bottom 45%,661330,39,Top 10%,65400,203,Top 35%,,,,,,
2018,33-3052,Transit and Railroad Police,"Protect and police railroad and transit property, employees, or passengers.",47.8 ,451,Bottom 30%,4470,593,Bottom 5%,74450,166,Top 30%,,,,,,
2018,33-9011,Animal Control Workers,"Handle animals for the purpose of investigations of mistreatment, or control of abandoned, dangerous, or unattended animals.",48.1 ,406,Bottom 35%,12080,528,Bottom 15%,38490,463,Bottom 30%,,,,,,
2018,33-9021,Private Detectives and Investigators,"Gather, analyze, compile and report information regarding individuals or organizations to clients, or detect occurrences of unlawful acts or infractions of rules in private establishment. ",50.0 ,172,Top 30%,30990,410,Bottom 35%,56810,278,Top 45%,,,,,,
2018,33-9031,Gaming Surveillance Officers and Gaming Investigators,"Act as oversight and security agent for management and customers.  Observe casino or casino hotel operation for irregular activities such as cheating or theft by either employees or patrons.  May use one-way mirrors above the casino floor, cashier's cage, and from desk.  Use of audio/video equipment is also common to observe operation of the business.  Usually required to provide verbal and written reports of all violations and suspicious behavior to supervisor.",50.6 ,114,Top 20%,10230,544,Bottom 15%,36200,495,Bottom 25%,,,,,,
2018,33-9032,Security Guards,"Guard, patrol, or monitor premises to prevent theft, violence, or infractions of rules.  May operate x-ray and metal detector equipment.  Excludes “Transportation Security Screeners” (33-9093).",49.6 ,212,Top 35%,1114380,23,Top 5%,32050,538,Bottom 15%,,,,,,
2018,33-9091,Crossing Guards,"Guide or control vehicular or pedestrian traffic at such places as streets, schools, railroad crossings, or construction sites.",47.8 ,455,Bottom 30%,79880,260,Top 45%,31970,540,Bottom 15%,,,,,,
2018,33-9092,"Lifeguards, Ski Patrol, and Other Recreational Protective Service Workers","Monitor recreational areas, such as pools, beaches, or ski slopes to provide assistance and protection to participants.",47.3 ,505,Bottom 20%,144370,171,Top 30%,24420,609,Bottom 5%,,,,,,
2018,35-1011,Chefs and Head Cooks,"Direct and may participate in the preparation, seasoning, and cooking of salads, soups, fish, meats, vegetables, desserts, or other foods.  May plan and price menu items, order supplies, and keep records and accounts. ",48.1 ,407,Bottom 35%,128600,193,Top 35%,52160,315,Bottom 50%,,,,,,
2018,35-1012,First-Line Supervisors of Food Preparation and Serving Workers,Directly supervise and coordinate activities of workers engaged in preparing and serving food.,48.5 ,358,Bottom 45%,964400,27,Top 5%,36190,496,Bottom 25%,,,,,,
2018,35-2011,"Cooks, Fast Food",Prepare and cook food in a fast food restaurant with a limited menu.  Duties of these cooks are limited to preparation of a few basic items and normally involve operating large-volume single-purpose cooking equipment.,47.5 ,492,Bottom 25%,487510,59,Top 10%,22650,619,Bottom 5%,,,,,,
2018,35-2012,"Cooks, Institution and Cafeteria","Prepare and cook large quantities of food for institutions, such as schools, hospitals, or cafeterias.",49.6 ,202,Top 35%,400320,74,Top 15%,28290,582,Bottom 10%,,,,,,
2018,35-2013,"Cooks, Private Household",Prepare meals in private homes.  Includes personal chefs.,46.9 ,539,Bottom 15%,460,619,Bottom 5%,41240,431,Bottom 35%,,,,,,
2018,35-2014,"Cooks, Restaurant","Prepare, season, and cook dishes such as soups, meats, vegetables, or desserts in restaurants.  May order supplies, keep records and accounts, price items on menu, or plan menu.",48.7 ,332,Bottom 50%,1340810,19,Top 5%,27580,585,Bottom 10%,,,,,,
2018,35-2015,"Cooks, Short Order","Prepare and cook to order a variety of foods that require only a short preparation time.  May take orders from customers and serve patrons at counters or tables.  Excludes ""Fast Food Cooks"" (35-2011).",48.4 ,363,Bottom 45%,155840,164,Top 30%,25140,601,Bottom 5%,,,,,,
2018,35-2021,Food Preparation Workers,"Perform a variety of food preparation duties other than cooking, such as preparing cold foods and shellfish, slicing meat, and brewing coffee or tea.",48.7 ,320,Bottom 50%,814600,32,Top 10%,24830,606,Bottom 5%,,,,,,
2018,35-3011,Bartenders,"Mix and serve drinks to patrons, directly or through waitstaff.",46.8 ,545,Bottom 15%,631480,45,Top 10%,26780,590,Bottom 5%,,,,,,
2018,35-3021,"Combined Food Preparation and Serving Workers, Including Fast Food",Perform duties which combine preparing and serving food and nonalcoholic beverages.,49.3 ,244,Top 40%,3676180,2,Top 1%,22140,620,Bottom 5%,,,,,,
2018,35-3022,"Counter Attendants, Cafeteria, Food Concession, and Coffee Shop","Serve food to diners at counter or from a steam table.  Counter attendants who also wait tables are included in ""Waiters and Waitresses"" (35-3031).",48.1 ,410,Bottom 35%,473860,60,Top 10%,23240,615,Bottom 5%,,,,,,
2018,35-3031,Waiters and Waitresses,"Take orders and serve food and beverages to patrons at tables in dining establishment.  Excludes ""Counter Attendants, Cafeteria, Food Concession, and Coffee Shop"" (35-3022).",46.9 ,537,Bottom 15%,2582410,7,Top 5%,25830,598,Bottom 5%,,,,,,
2018,35-3041,"Food Servers, Nonrestaurant","Serve food to individuals outside of a restaurant environment, such as in hotel rooms, hospital rooms, residential care facilities, or cars.  Excludes ""Door-to-Door Sales Workers, News and Street Vendors, and Related Workers"" (41-9091) and ""Counter Attendants, Cafeteria, Food Concession, and Coffee Shop"" (35-3022).",46.9 ,540,Bottom 15%,266190,115,Top 20%,24980,605,Bottom 5%,,,,,,
2018,35-9011,Dining Room and Cafeteria Attendants and Bartender Helpers,"Facilitate food service.  Clean tables, remove dirty dishes, replace soiled table linens; set tables; replenish supply of clean linens, silverware, glassware, and dishes; supply service bar with food; and serve items such as water, condiments, and coffee to patrons.",46.2 ,576,Bottom 10%,455700,64,Top 15%,23950,611,Bottom 5%,,,,,,
2018,35-9021,Dishwashers,"Clean dishes, kitchen, food preparation equipment, or utensils.",48.3 ,384,Bottom 40%,504770,57,Top 10%,23190,617,Bottom 5%,,,,,,
2018,35-9031,"Hosts and Hostesses, Restaurant, Lounge, and Coffee Shop","Welcome patrons, seat them at tables or in lounge, and help ensure quality of facilities and service.",47.8 ,457,Bottom 30%,416950,69,Top 15%,23260,614,Bottom 5%,,,,,,
2018,37-1011,First-Line Supervisors of Housekeeping and Janitorial Workers,"Directly supervise and coordinate work activities of cleaning personnel in hotels, hospitals, offices, and other establishments.",47.9 ,438,Bottom 30%,154180,165,Top 30%,43150,403,Bottom 40%,,,,,,
2018,37-1012,"First-Line Supervisors of Landscaping, Lawn Service, and Groundskeeping Workers","Directly supervise and coordinate activities of workers engaged in landscaping or groundskeeping activities.  Work may involve reviewing contracts to ascertain service, machine, and workforce requirements; answering inquiries from potential customers regarding methods, material, and price ranges; and preparing estimates according to labor, material, and machine costs.",48.0 ,427,Bottom 35%,101390,234,Top 40%,51280,321,Bottom 50%,,,,,,
2018,37-2011,"Janitors and Cleaners, Except Maids and Housekeeping Cleaners","Keep buildings in clean and orderly condition.  Perform heavy cleaning duties, such as cleaning floors, shampooing rugs, washing walls and glass, and removing rubbish.  Duties may include tending furnace and boiler, performing routine maintenance activities, notifying management of need for repairs, and cleaning snow or debris from sidewalk.",45.4 ,603,Bottom 5%,2156270,11,Top 5%,28950,570,Bottom 10%,,,,,,
2018,37-2012,Maids and Housekeeping Cleaners,"Perform any combination of light cleaning duties to maintain private households or commercial establishments, such as hotels and hospitals, in a clean and orderly manner.  Duties may include making beds, replenishing linens, cleaning rooms and halls, and vacuuming.",44.8 ,616,Bottom 5%,924290,28,Top 5%,25570,599,Bottom 5%,,,,,,
2018,37-2021,Pest Control Workers,Apply or release chemical solutions or toxic gases and set traps to kill or remove pests and vermin that infest buildings and surrounding areas. ,47.4 ,494,Bottom 25%,77300,266,Top 45%,37950,469,Bottom 25%,,,,,,
2018,37-3011,Landscaping and Groundskeeping Workers,"Landscape or maintain grounds of property using hand or power tools or equipment.  Workers typically perform a variety of tasks, which may include any combination of the following: sod laying, mowing, trimming, planting, watering, fertilizing, digging, raking, sprinkler installation, and installation of mortarless segmental concrete masonry wall units.  Excludes ""Farmworkers and Laborers, Crop, Nursery, and Greenhouse"" (45-2092).",48.0 ,413,Bottom 35%,913480,30,Top 5%,30940,553,Bottom 15%,,,,,,
2018,37-3012,"Pesticide Handlers, Sprayers, and Applicators, Vegetation","Mix or apply pesticides, herbicides, fungicides, or insecticides through sprays, dusts, vapors, soil incorporation, or chemical application on trees, shrubs, lawns, or botanical crops.  Usually requires specific training and State or Federal certification.  Excludes ""Commercial Pilots"" (53-2012) who dust or spray crops from aircraft.",48.7 ,333,Bottom 50%,24500,439,Bottom 30%,38210,465,Bottom 30%,,,,,,
2018,37-3013,Tree Trimmers and Pruners,"Using sophisticated climbing and rigging techniques, cut away dead or excess branches from trees or shrubs to maintain right-of-way for roads, sidewalks, or utilities, or to improve appearance, health, and value of tree.  Prune or treat trees or shrubs using handsaws, hand pruners, clippers, and power pruners.  Works off the ground in the tree canopy and may use truck-mounted lifts.  Excludes workers who primarily perform duties of ""Pesticide Handlers, Sprayers, and Applicators, Vegetation"" (37-3012) and ""Landscaping and Groundskeeping Workers"" (37-3011).",47.9 ,439,Bottom 30%,42440,356,Bottom 45%,40510,443,Bottom 30%,,,,,,
2018,39-1021,First-Line Supervisors of Personal Service Workers,"Directly supervise and coordinate activities of personal service workers, such as flight attendants, hairdressers, or caddies.",47.9 ,441,Bottom 30%,228620,129,Top 25%,41710,424,Bottom 35%,,,,,,
2018,39-2011,Animal Trainers,"Train animals for riding, harness, security, performance, or obedience, or assisting persons with disabilities.  Accustom animals to human voice and contact; and condition animals to respond to commands.  Train animals according to prescribed standards for show or competition.  May train animals to carry pack loads or work as part of pack team.",45.1 ,607,Bottom 5%,14830,504,Bottom 20%,35260,506,Bottom 20%,,,,,,
2018,39-2021,Nonfarm Animal Caretakers,"Feed, water, groom, bathe, exercise, or otherwise care for pets and other nonfarm animals, such as dogs, cats, ornamental fish or birds, zoo animals, and mice.  Work in settings such as kennels, animal shelters, zoos, circuses, and aquariums.  May keep records of feedings, treatments, and animals received or discharged.  May clean, disinfect, and repair cages, pens, or fish tanks.  Excludes ""Veterinary Assistants and Laboratory Animal Caretakers"" (31-9096).",47.7 ,466,Bottom 25%,199850,143,Top 25%,25890,596,Bottom 5%,,,,,,
2018,39-3011,Gaming Dealers,"Operate table games.  Stand or sit behind table and operate games of chance by dispensing the appropriate number of cards or blocks to players, or operating other gaming equipment.  Distribute winnings or collect players' money or chips.  May compare the house's hand against players' hands.",51.4 ,76,Top 15%,92530,242,Top 40%,23070,618,Bottom 5%,,,,,,
2018,39-3012,Gaming and Sports Book Writers and Runners,"Post information enabling patrons to wager on various races and sporting events.  Assist in the operation of games such as keno and bingo.  May operate random number generating equipment and announce the numbers for patrons.  Receive, verify, and record patrons' wagers.  Scan and process winning tickets presented by patrons and payout winnings for those wagers.  ",52.9 ,34,Top 10%,11150,535,Bottom 15%,27640,584,Bottom 10%,,,,,,
